{
  "schema_version": 1,
  "id": "maintainability-review",
  "name": "Maintainability Review",
  "description": "Pinned local analysis tooling for canonical maintainability implementation reviews. Review execution only discovers installed tools and never installs or upgrades them.",
  "requirements": [
    {
      "id": "jscpd",
      "name": "jscpd",
      "description": "Local copy-paste and bounded maintainability candidate analyzer. Review the MIT license, Node.js installation compatibility, and pinned package metadata before installing.",
      "kind": "binary",
      "required": true,
      "provides": ["duplication-analysis"],
      "depends_on": [],
      "detect": {"command": "jscpd"},
      "installers": [
        {
          "id": "npm",
          "kind": "npm-global",
          "platforms": ["darwin", "linux", "windows"],
          "package": "jscpd",
          "version": "5.3.2"
        }
      ]
    }
  ]
}
